PRS_NAT;PRS_NAT_STA;PRS_NAT_CB2;PRS_NAT_LIB;NAT_SOI_TOP;TDM_NAT_AFF;PRS_NAT_TDM;NAT_CPL_ACT;CCA_CPL_COD;PRN_AID_TOP;PRS_SPP_TOP;TOP_SNI;TYA_COD;CEL_TYP;TOP_PRS_SOI;PRS_NAT_RGT;TOP_TRF_OPP;PRS_NAT_OBS;TEC_COL
0;99;;SANS OBJET;0;9;99;0;;0;;0;Z;;0;0;;;2
1089;99;COM;EXAMEN OBLIGATOIRE ENFANT COM;1;9;99;0;;1;;1;C;20;0;1;1;;0
1090;99;COH;EXAMEN OBLIGATOIRE ENFANT COH;1;9;99;0;;1;;1;C;20;0;1;1;;0
1091;99;COD;EXAMEN OBLIGATOIRE ENFANT COD;1;9;99;0;;1;;1;C;20;0;1;1;;0
1092;99;COG;EXAMEN OBLIGATOIRE ENFANT COG;1;9;99;0;;1;;1;C;20;0;1;1;;0
1093;99;COB;EXAMEN OBLIGATOIRE ENFANT COB;1;9;99;0;;1;;1;C;20;0;1;1;;0
1095;99;MTJ;MAJORATION SPECIFIQUE MOINS DE 16 ANS MAYOTTE;1;9;99;1;23;0;;1;Z;20;0;1;1;;0
1096;99;TTE;TELECONSULTATION MEDECIN TRAITANT AVEC EHPAD;1;9;99;0;;0;;1;C;20;0;1;;ferme le 14/09/2018;0
1097;99;TDT;TELE EXPERTISE DOSSIER TRAITANT;1;9;99;0;;0;;1;C;20;0;1;;ferme le 09/02/2019;0
1098;99;U03;CONSULTATION CCMU 3;1;9;99;0;;0;;1;C;20;0;1;1;;0
1099;99;U45;CONSULTATION CCMU 4 ET 5;1;9;99;0;;0;;1;C;20;0;1;1;;0
1100;99;RNM;PROTOCOLE MURAINE - BILAN VISUEL;1;9;99;0;;1;;1;C;20;0;1;1;;0
1101;99;APU;AVIS PONCTUEL DE CONSULTANT PUPH;1;9;99;0;;1;1;1;C;20;0;1;1;;0
1102;99;APY;AVIS PONCTUEL DE CONSULTANT PSYCHIATRE;1;9;99;0;;1;1;1;C;20;0;1;1;;0
1103;99;APC;AVIS PONCTUEL DE CONSULTANT DU MEDECIN;1;9;99;0;;1;1;1;C;20;0;1;1;;0
1104;99;COE;CONSULTATION OBLIGATOIRE ENFANT;1;9;99;0;;1;;1;C;20;0;1;1;;0
1105;99;CCX;CONSULTATION COMPLEXE;1;9;99;0;;1;;1;C;20;0;1;1;;0
1106;99;MCX;MAJORATION CONSULTATION COMPLEXE;1;9;99;1;22;0;;1;C;20;0;1;1;;0
1107;99;CCE;CONSULTATION TRES COMPLEXE ENFANT;1;9;99;0;;1;;1;C;20;0;1;1;;0
1108;99;MTX;MAJORATION CONSULTATION TRES COMPLEXE;1;9;99;1;22;0;;1;C;20;0;1;1;;0
1109;99;GS;CONSULTATION SPECIALISTE MEDECINE GENERALE;1;9;99;0;;1;1;1;C;20;0;1;1;;0
1110;99;G;CONSULTATION MEDECINE GENERALE;1;9;99;0;;1;1;1;C;20;0;1;1;;0
1111;99;C;CONSULTATION COTEE C;1;9;99;0;;1;1;1;C;20;0;1;1;;0
1112;99;CS;CONSULTATION COTEE CS;1;9;99;0;;1;1;1;C;20;0;1;1;;0
1113;99;CNP;CONSULTATION COTEE CNP;1;9;99;0;;1;1;1;C;20;0;1;1;;0
1114;99;CSC;CONSULTATION SPECIFIQUE CARDIOLOGIE;1;9;99;0;;1;1;1;C;20;0;1;1;;0
1115;99;CA;CONSULTATION BILAN;1;9;99;0;;1;;1;C;20;0;1;1;fermé le 01/07/2017;0
1116;99;MPC;MAJORATION FORFAITAIRE TRANSITOIRE;1;9;99;1;6;0;1;1;Z;20;0;1;1;;0
1117;99;;CONSULTATION DES SPECIALISTES COTEE C2;1;9;99;0;;1;1;1;C;20;0;1;1;;0
1118;99;;CONSULTATION DES PSYCHIATRES COTEE C2,5;1;9;99;0;;1;1;1;C;20;0;1;1;;0
1119;99;MTS;MAJORATION TRANSITOIRE SPECIFIQUE;1;9;99;1;23;0;;1;Z;20;0;1;1;;0
1120;99;CCS;COMPLEMENT CONSULTATION SPECIALISTE;1;9;99;1;26;0;1;1;C;20;0;1;;;0
1121;99;HS;HONORAIRE DE SURVEILLANCE;1;9;99;0;;0;;1;C;20;0;1;;;0
1122;99;EXS;EXAMEN SPECIAL (PROTOCOLE);1;9;99;0;;0;;1;C;20;0;16;1;;0
1123;99;SES;SUITE D  EXAMEN DE SANTE;1;9;99;0;;1;;1;C;20;0;1;1;;0
1124;99;RMT;REMUNERATION MEDECIN TRAITANT PAR PATIENT  EN ALD;1;9;99;0;;0;;1;Z;20;0;47;;fermé le 31/12/2017;0
1125;99;MCG;MAJORATION DE COORDINATION DES GENERALISTES;1;9;99;1;18;0;1;1;Z;20;0;1;1;;0
1126;99;MCS;MAJORATION DE COORDINATION SPECIALISTES;1;9;99;1;18;0;1;1;Z;20;0;1;1;;0
1127;99;MCC;MAJORATION DE COORDINATION CARDIOLOGUES;1;9;99;1;18;0;;1;Z;20;0;1;1;;0
1128;99;DRT;DIFFERENTIEL REFERENT TRAITANT;1;9;99;0;;0;;1;Z;20;0;47;;;0
1129;99;MPJ;MAJORATION FORFAITAIRE TRANSITOIRE (POUR LES MOINS DE 16 ANS);1;9;99;1;6;0;1;1;Z;20;0;1;1;fermé le 31/12/2017;0
1130;99;FMT;FORFAIT MEDECIN TRAITANT;1;9;99;0;;0;;1;Z;20;0;47;;fermé le 31/12/2017;0
1131;99;MTA;MAJORATION CONSULTATION APPAREILLAGE;1;9;99;1;22;0;;1;C;20;0;1;1;;0
1132;99;MCE;MAJORATION CONSULTATION ENDOCRINO;1;9;99;1;22;0;;1;C;20;0;1;1;;0
1133;99;MGE;MAJORATION GENERALISTE ENFANT;1;9;99;1;5;0;;1;C;20;0;1;1;fermé le 31/12/2017;0
1134;99;MPF;MAJORATION PREMIERE CONSULTATION FAMILLE;1;9;99;1;22;0;;1;C;20;0;1;1;;0
1135;99;MAF;MAJORATION CONSULTATION ANNUELLE FAMILLE;1;9;99;1;22;0;;1;C;20;0;1;1;;0
1136;99;MAS;MAJORATION ANNUELLE DE SYNTHESE;1;9;99;1;5;0;;1;C;20;0;1;1;fermé le 31/12/2017;0
1137;99;MBB;MAJORATION NOURRISSON;1;9;99;1;5;0;;1;C;20;0;1;1;fermé le 31/12/2017;0
1138;99;RAA;REMUNERATION ADDITIONNELLE CAPI;1;9;99;1;28;0;;1;Z;20;0;47;;fermé le 30/06/2017;0
1139;99;RAC;REMUNERATION DES ADHERENTS AU  CAPI;1;9;99;0;;0;;1;Z;20;0;47;;fermé le 30/06/2012;0
1140;99;CDE;CONSULTATION SPECIFIQUE DE DEPISTAGE;1;9;99;0;;1;;1;C;20;0;1;1;;0
1141;99;MPE;MAJORATION PEDIATRE ENFANT;1;9;99;1;5;0;;1;C;20;0;1;1;fermé le 31/12/2017;0
1142;99;RSO;REMUNERATION ADHESION SOPHIA (SOINS DE VILLE);1;9;99;0;;0;;1;Z;20;0;47;;;0
1143;99;RSR;REMUNERATION RENOUVELLEMENT SOPHIA (SOINS DE VILLE);1;9;99;0;;0;;1;Z;20;0;47;;;0
1144;99;RST;REMUNERATION FORFAITAIRE POUR LE SUIVI DES PATIENTS EN POST ALD;1;9;99;0;;0;;1;Z;20;0;47;;fermé le 31/12/2017;0
1145;99;P4P;REMUNERATION OBJECTIF MEDECIN ET CENTRES DE SANTE;1;9;99;0;;0;;1;Z;21;0;47;;;0
1146;99;R4P;REMUNERATION OBJECTIF MEDECIN COMPLEMENT ET CENTRES DE SANTE;1;9;99;0;;0;;1;Z;21;0;47;;;0
1147;99;CFM;CONTESTATION FORFAIT MEDECIN TRAITANT;1;9;99;0;;0;;1;Z;20;0;47;;;0
1148;99;MPA;REMUNERATION FORFAITAIRE PAR CONSULTATION POUR LE SUIVI DES PERSONNES AGEES;1;9;99;0;;0;;1;Z;20;0;47;;;0
1149;99;CPA;CONTESTATION REMUNERATION SUIVI PERSONNES AGEES;1;9;99;0;;0;;1;Z;20;0;47;;;0
1150;99;RPT;REMUNERATION PRATICIENS TERRITORIAUX DE MEDECINE GENERALE;1;9;99;0;;0;;1;Z;20;0;47;;;0
1152;99;MPP;MAJORATION SUIVI DES ENFANTS GRANDS PREMATURES OU ATTEINTS DE PATHOLOGIE CONGENITALE GRAVE;1;9;99;1;22;0;;1;C;20;0;1;1;fermé le 31/12/2017;0
1153;99;MIC;MAJORATION CONSULTATION POUR INSUFFISANT CARDIAQUE APRES HOSPITALISATION;1;9;99;1;22;0;;1;C;20;0;1;1;;0
1154;99;MSH;MAJORATION CONSULTATION SUIVI APRES HOSPITALISATION PATIENTS A FORTE COMORBIDITE;1;9;99;1;22;0;;1;C;20;0;1;1;;0
1155;99;COT;REMU CAS COTISATIONS SOCIALES;1;9;99;0;;0;;1;Z;20;0;47;;;0
1156;99;CCO;CONT. CAS COT.SOC.;1;9;99;0;;0;;1;Z;20;0;47;;;0
1157;99;TCP;Acte de téléconsultation;1;9;99;0;;0;;1;Z;20;0;1;;;0
1158;99;TEP;Acte de télé expertise;1;9;99;0;;0;;1;Z;20;0;1;;;0
1159;99;RNO;renouvellement d'optique;1;9;99;0;;0;;1;C;20;0;1;0;;0
1160;99;IAS;INVESTISSEMENT ACTIVITE SAISONNIERE;1;9;99;0;;0;;1;Z;20;0;47;;;0
1161;99;CPS;COMPLEMENT PRATIQUE SAISONNIERE;1;9;99;0;;0;;1;Z;20;0;47;;;0
1162;99;RCM;REMUNERATION DES PRATICIENS TERRITORIAUX DE MEDECINE AMBULATOIRE;1;9;99;0;;0;;1;Z;20;0;47;;;0
1163;99;KIT;REMUNERATION DEPISTAGE DU CANCER COLORECTAL;1;9;99;0;;0;;1;Z;20;0;47;;;0
1164;99;TLC;TÉLÉ CONSULTATION - ALD ET / OU EHPAD;1;9;99;0;;1;;1;C;20;0;1;;ferme le 14/09/2018;0
1165;99;TLE;TÉLÉ EXPERTISE - ALD ET/OU EHPAD;1;9;99;0;;0;;1;Z;20;0;1;;ferme le 09/02/2019;0
1166;99;TEC;FORFAIT COMPLÉMENTAIRE TÉLÉ EXPERTISE;1;9;99;0;;0;;1;Z;20;0;47;;;0
1167;99;NRD;VERSEMENT DE PENALITE DE RETARD AMO;1;9;99;0;;0;;1;Z;21;0;47;;;0
1168;99;CCP;CONSULTATION DE CONTRACEPTION ET PREVENTION;1;9;99;0;;1;;1;C;20;0;1;1;;0
1169;99;RCD;REMUNERATION POUR CERTIFICAT DE DECES;1;9;99;0;;0;;1;Z;20;0;47;;;0
1170;99;DHE;PEC EXCEPTIONNELLE DÉPASSEMENT HONORAIRE;1;9;99;0;;0;;1;Z;20;0;1;;;0
1171;99;CSR;RÉMUNÉRATION MÉDECIN TRAITANT CENTRES DE SANTÉ;1;9;99;0;;0;;0;Z;20;0;0;;;0
1172;99;TSA;TELESURVEILLANCE : PS EFFECTUANT L'ACCOMPAGNEMENT;1;9;99;0;;1;;1;C;20;0;1;;;0
1173;99;MTF;FORFAIT PATIENTELE MEDECIN TRAITANT;1;9;99;0;;0;;1;Z;21;0;47;;;0
1174;99;TSM;TELESURVEILLANCE : MEDECIN TELESURVEILLANT;1;9;99;0;;1;;1;C;20;0;1;;;0
1175;99;DHT;PEC EXCEPTIONNELLE DEPASSEMENT HONORAIRE TP;1;9;99;0;;0;;1;Z;20;0;1;;;0
1176;99;COI;CONTRAT INDIVIDUEL EMBAUCHE - AVANCE;1;9;99;0;;0;;1;Z;20;0;47;;;0
1177;99;AFC;AIDE FINANCIERE MATERNITE PATERNITE ADOPTION;1;9;99;0;;0;;1;Z;20;0;47;;;0
1178;99;P6P;FORFAIT STRUCT. MEDECIN;1;9;99;0;;0;;1;Z;21;0;47;;;0
1179;99;R6P;FORFAIT STRUCT. MEDECIN COMPLEMENT;1;9;99;0;;0;;1;Z;21;0;47;;;0
1180;99;P5P;ROSP MT ENFANT;1;9;99;0;;0;;1;Z;21;0;47;;;0
1181;99;R5P;ROSP MT ENFANT COMPLEMENT;1;9;99;0;;0;;1;Z;21;0;47;;;0
1182;99;PTM;REMUNERATION OPTAM;1;9;99;0;;0;;1;Z;21;0;47;;;0
1183;99;CTM;CONTESTATION OPTAM;1;9;99;0;;0;;1;Z;21;0;47;;;0
1184;99;COS;CONTRAT INDIVIDUEL EMBAUCHE - SOLDE;1;9;99;0;;0;;1;Z;20;0;47;;;0
1185;99;RNB;MURAINE - PAIEMENT DU BONUS ANNUEL;1;9;99;0;;0;;1;Z;20;0;47;;;0
1186;99;COC;CONTRAT INDIVIDUEL EMBAUCHE   OBJECTIFS COMPLEMENTAIRES;1;9;99;0;;0;;1;Z;20;0;47;;;0
1187;99;CCI;CONTRAT COLLECTIF   AIDE INVESTISSEMENT;1;9;99;0;;0;;0;Z;20;0;47;;;0
1188;99;CCA;CONTRAT COLLECTIF   ATTEINTE DES OBJECTIFS;1;9;99;0;;0;;0;Z;20;0;47;;;0
1189;99;COF;CONTRAT DE FORMATION;1;9;99;0;;0;;1;Z;20;0;47;;;0
1190;99;TSP;TELESURVEILLANCE : PRIME VARIABLE;1;9;99;0;;0;;1;Z;21;0;47;;;0
1191;99;TC;TELECONSULTATION TOUTES SPECIALITES;1;9;99;0;;1;1;1;C;20;0;1;;;0
1192;99;TCG;TELECONSULTATION GENERALISTE;1;9;99;0;;1;1;1;C;20;0;1;;;0
1193;99;TE1;TELE EXPERTISE DE NIVEAU 1;1;9;99;0;;1;;1;C;20;0;1;1;;0
1194;99;TE2;TELE EXPERTISE DE NIVEAU 2;1;9;99;0;;1;;1;C;20;0;1;1;;0
1195;99;A51;FOND INNOVATION - PAIEMENT;1;9;99;0;;0;;1;Z;21;0;47;;;0
1196;99;FIS;FORFAIT INNOVATION SYSTEME DE SANTE;1;9;99;0;;1;;1;Z;20;0;46;;;0
1197;99;RQT;FORFAIT REQUERANT;1;9;99;0;;0;;1;Z;21;0;47;;;0
1198;99;CRT;FORFAIT REQUERANT COMPLEMENTAIRE;1;9;99;0;;0;;1;Z;21;0;47;;;0
1209;99;VGS;VISITE SPECIALISTE MEDECINE GENERALE;1;9;99;0;;1;;1;C;20;0;1;1;;0
1210;99;VG;VISITE MEDECINE GENERALE;1;9;99;0;;1;;1;C;20;0;1;1;;0
1211;99;V;VISITE COTEE V;1;9;99;0;;1;;1;C;20;0;1;1;;0
1212;99;VS;VISITE COTEE VS;1;9;99;0;;1;;1;C;20;0;1;1;;0
1213;99;VNP;VISITE COTEE VNP;1;9;99;0;;1;;1;C;20;0;1;1;;0
1214;99;VL;VISITE LONGUE ET COMPLEXE;1;9;99;0;;1;;1;C;20;0;1;1;;0
1215;99;APV;AVIS PONCTUEL DE CONSULTANT MEDECIN (VISITE);1;9;99;0;;1;;1;C;20;0;1;1;;0
1216;99;AVY;AVIS PONCTUEL DE CONSULTANT PSYCHIATRE (VISITE);1;9;99;0;;1;;1;C;20;0;1;1;;0
1221;99;VA;VISITE D  URGENCE;1;9;99;0;;1;;1;C;20;0;1;1;fermé le 15/09/2014;0
1222;99;VU;VISITE URGENCE VU/MU;1;9;99;0;;1;;1;C;20;0;1;1;;0
1223;99;MMD;MAJORATION MAINTIEN A DOMICILE;1;9;99;1;4;0;;1;Z;;0;1;;fermé le 30/09/2002;0
1224;99;MD;MD (CRITERES MEDICAUX);1;9;99;1;4;0;1;1;Z;20;0;1;1;;0
1225;99;MDE;MDE ( CRITERES ENVIRONNEMENTAUX);1;9;99;1;4;0;;1;Z;20;0;1;1;fermé le 10/02/2007;0
1226;99;MDN;MD DE NUIT;1;9;99;1;1;0;1;1;Z;20;0;1;1;;0
1227;99;MDI;MD  DE MILIEU NUIT;1;9;99;1;1;0;1;1;Z;20;0;1;1;;0
1228;99;MDD;MD  DE DIMANCHE ET JOUR FERIES;1;9;99;1;2;0;1;1;Z;20;0;1;1;;0
1229;99;MEN;MDE  DE NUIT;1;9;99;1;1;0;;1;Z;;0;1;;fermé le 31/03/2003;0
1231;99;MEI;MDE MILIEU DE NUIT;1;9;99;1;1;0;;1;Z;;0;1;;fermé le 31/03/2003;0
1232;99;MED;MDE DIMANCHE ET JOUR FERIES;1;9;99;1;2;0;;1;Z;;0;1;;fermé le 31/03/2003;0
1311;99;KC;ACTES EN K CHIRURGICAL;1;9;99;0;;1;1;1;T;20;0;37;1;fermé le 01/12/2014;0
1312;99;K;ACTES DE SPECIALITE EN K;1;9;99;0;;1;1;1;T;20;0;1;1;;0
1313;99;KA;ACTES EN K D  URGENCE;1;9;99;0;;1;;1;T;20;0;1;1;fermé le 01/01/2011;0
1314;99;KFA;FORFAIT CHIRURGIE 1;1;9;99;1;8;0;;1;Z;20;0;1;;fermé le 31/12/2006;0
1315;99;KFB;FORFAIT CHIRURGIE 2;1;9;99;1;8;0;;1;Z;20;0;1;;fermé le 31/12/2006;0
1316;99;KE;ACTES DE DIAGNOSTIC COTES KE;1;9;99;0;;1;1;1;T;20;0;1;1;;0
1317;99;KCC;ACTES EN KCC: ACTES SPECIFIQUES DES CHIRURGIENS;1;9;99;0;;0;;1;T;20;0;1;1;fermé le 31/12/2006;0
1318;99;KMO;ACTE DE PHONIATRIE PAR MEDECIN;1;9;99;0;;1;;1;T;20;0;1;1;;0
1319;99;KFC;MAJORATION FORFAIT ACCOUCHEMENT;1;9;99;1;7;0;;1;Z;20;0;1;;fermé le 31/12/2006;0
1320;99;KFD;FORFAIT RADIOGRAPHIE,ECHOGRAPHIE;1;9;99;1;15;0;;1;T;20;0;1;;fermé le 31/12/2006;0
1321;99;ADC;ACTE DE CHIRURGIE CCAM;1;9;99;0;;1;1;1;T;20;1;44;1;;0
1322;99;ACO;ACTE D'OBSTETRIQUE CCAM;1;9;99;0;;1;1;1;T;20;0;25;1;;0
1323;99;ADA;ACTE D'ANESTHESIE CCAM;1;9;99;0;;1;1;1;T;20;0;25;1;;0
1324;99;ADE;ACTE D'ECHOGRAPHIE CCAM;1;9;99;0;;1;1;1;T;20;0;25;1;;0
1331;99;Z;ACTES DE RADIOLOGIE;1;9;99;0;;1;1;1;T;20;0;1;1;;0
1332;99;ZN;ACTES DE RADIOLOGIE NUCLEAIRE;1;9;99;0;;0;;1;T;20;0;1;;fermé le 31/12/2006;0
1333;99;PRA;MAJORATION POUR PRODUIT RADIOPHARMACEUTIQUE;1;9;99;1;9;0;;1;T;20;0;1;;fermé le 31/12/2006;0
1335;99;ZM/ADI;ACTE DE RADIOLOGIE MAMMOGRAPHIE;1;9;99;0;;1;;1;T;;0;1;1;ZM : fermé le 31/12/2006;0
1336;99;ZM DEPISTAGE/ADI;ACTE DE RADIOLOGIE MAMMOGRAPHIE DEPISTAGE;1;9;99;0;;1;;1;T;;0;1;1;ZM : fermé le 31/12/2006;0
1341;99;P;ACTES D  ANATOMO-CYTO-PATHOLOGIE/MEDECINS;1;9;99;0;;1;;1;T;20;0;1;1;fermé le 01/03/2011;0
1342;99;MAP;MAJORATION ANATOMO-CYTO-PATHOLOGIE;1;9;99;1;19;0;;1;Z;20;0;1;1;fermé le 01/03/2011;0
1345;99;MTC;MAJORATION TRANSITOIRE;1;9;99;1;14;0;;1;Z;20;0;1;;fermé le 31/12/2006;0
1351;99;ADI;ACTE D'IMAGERIE (hors ECHOGRAPHIE) CCAM;1;9;99;0;;1;1;1;T;20;1;25;1;;0
1352;99;ATM;ACTES TECHNIQUES MEDICAUX  (hors IMAGERIE) CCAM;1;9;99;0;;1;1;1;T;20;1;25;1;;0
1361;99;VDC;VIDEOCAPSULE;1;9;99;0;;0;;1;T;20;0;49;;;0
1400;99;BR1;BRIDGE RAC MODERE;1;9;99;0;;1;;1;T;20;1;42;;;0
1401;99;PF0;PROTHESE FIXE RAC 0;1;9;99;0;;1;;1;T;20;1;42;;;0
1402;99;PF1;PROTHESE FIXE RAC MODERE;1;9;99;0;;1;;1;T;20;1;42;;;0
1403;99;RF0;REPARATION FACETTE PROTHESE AMOVIBLE RAC 0;1;9;99;0;;1;;1;T;20;1;42;;;0
1404;99;RA0;REPARATION ADJONCTION RAC 0;1;9;99;0;;1;;1;T;20;1;42;;;0
1405;99;RS0;REPARATION PROTHESE ADJOINTE SIMPLE RAC 0;1;9;99;0;;1;;1;T;20;1;42;;;0
1406;99;SU0;SUPPLEMENT PROTHESE RESINE RAC 0;1;9;99;0;;1;;1;T;20;1;42;;;0
1407;99;CT1;COURONNE TRANSITOIRE RAC MODERE;1;9;99;0;;1;;1;T;20;1;42;;;0
1408;99;CZ1;COURONNE ZIRCONE RAC MODERE;1;9;99;0;;1;;1;T;20;1;42;;;0
1409;99;IC1;INLAY CORE RAC MODERE;1;9;99;0;;1;;1;T;20;1;42;;;0
1410;99;IN1;INLAY ONLAY RAC MOERE;1;9;99;0;;1;;1;T;20;1;42;;;0
1411;99;SCM/SPA;ACTES EN SCM (ET SPA POUR LA CRPCEN);1;9;99;0;;1;1;1;T;;1;34;1;SCM : fermé le 01/12/2014;0
1412;99;PA1;PROTHESE AMOVIBLE RAC MODERE;1;9;99;0;;1;;1;T;20;1;42;;;0
1413;99;RE1;REPARATION PROTHESE RAC MODERE;1;9;99;0;;1;;1;T;20;1;42;;;0
1414;99;SU1;SUPPLEMENT PROTHESE METALLIQUE RAC MODERE;1;9;99;0;;1;;1;T;20;1;42;;;0
1415;99;CM0;PROTHESE FIXE METALLIQUE RAC 0;1;9;99;0;;1;;1;T;20;1;42;;;0
1416;99;CT0;COURONNE TRANSITOIRE RAC 0;1;9;99;0;;1;;1;T;20;1;42;;;0
1417;99;CZ0;COURONNE ZIRCONE RAC 0;1;9;99;0;;1;;1;T;20;1;42;;;0
1418;99;IC0;INLAY CORE RAC 0;1;9;99;0;;1;;1;T;20;1;42;;;0
1419;99;PA0;PROTHESE AMOVIBLE RAC 0;1;9;99;0;;1;;1;T;20;1;42;;;0
1420;99;PT0;PROTHESE AMOVIBLE DE TRANSITION RAC 0;1;9;99;0;;1;;1;T;20;1;42;;;0
1421;99;PRO;ACTES DE PROTHESE DENTAIRE PRATIQUES PAR LE MEDECIN;1;9;99;0;;1;1;1;T;20;1;35;;fermé le 01/12/2014;0
1422;99;ORT/EOS;TRAITEMENTS D  ORTHODONTIE PRATIQUES PAR LE MEDECIN (ET EOS POUR LA CRPCEN);1;9;99;0;;1;;1;T;20;1;36;;;0
1423;99;SPR;ACTES DE PROTHESE DENTAIRE PRATIQUES PAR LE CHIRURGIEN-DENTISTE;1;9;99;0;;1;1;1;Z;20;0;35;;fermé le 01/12/2014;0
1424;99;TO/ETO;TRAITEMENTS D  ORTHODONTIE PRATIQUES PAR LE CHIRURGIEN-DENTISTE (ET ETO POUR LA CRPCEN);1;9;99;0;;1;;1;Z;;0;36;;;0
1425;99;ATD;COMPLEMENT AT 150% DENTAIRE;1;9;99;1;27;0;;1;Z;20;0;35;;;0
1426;99;DDE;PEC EXCEPTIONNELLE DÉPASSEMENT DENTAIRE;1;9;99;0;;0;;1;Z;20;0;41;;;0
1427;99;DDT;PEC EXCEPTIONNELLE DEPASSEMENT DENTAIRE TP;1;9;99;0;;0;;1;Z;20;0;41;;;0
1431;99;D/OCC;ACTES EN D (ET OCC POUR LA CRPCEN);1;9;99;0;;1;1;1;Z;;0;2;;fermé le 01/12/2014;0
1432;99;DC;ACTES EN DC;1;9;99;0;;1;1;1;Z;20;0;37;;;0
1433;99;SC/SCA;ACTES EN SC (ET SCA POUR LA CRPCEN);1;9;99;0;;1;1;1;Z;;0;34;;SC: fermé le 01/12/2014;0
1434;99;BDC;PREVENTION BUCCO-DENTAIRE: CONSULTATION - MATER;1;9;99;0;;1;;1;Z;20;0;20;;;0
1435;99;BR2;PREVENTION BUCCO-DENTAIRE: RADIO DEUX CLICHES-MATER;1;9;99;0;;1;;1;Z;20;0;20;;;0
1436;99;BR4;PREVENTION BUCCO-DENTAIRE: RADIO QUATRE CLICHES-MATER;1;9;99;0;;1;;1;Z;20;0;20;;;0
1437;99;MCD;Majoration spécifique PDS Clinique Dentiste;1;9;99;1;23;0;;1;Z;20;0;2;;;0
1451;99;SDE;SOINS DENTAIRES;1;9;99;0;;1;;1;T;20;1;41;1;;0
1452;99;PAR;PROTHESE AMOVIBLE DEFINITIVE RESINE, A partir du 01/04/2019 (en date de soins) PROTHESE AMOVIBLE RESINE TARIF LIBRE;1;9;99;0;;1;;1;T;20;1;42;;;0
1453;99;AXI;PROPHYLAXIE BUCCO DENTAIRE CCAM;1;9;99;0;;1;;1;T;20;1;41;1;;0
1461;99;ADP;ACTES DIVERS PROTHESE DENTAIRE CCAM;1;9;99;0;;0;;0;Z;;1;0;;;0
1462;99;PFM;PROTHESE FIXE METALLIQUE, A partir du 01/04/2019 (en date de soins) PROTHESE FIXE METALLIQUE TARIF LIBRE;1;9;99;0;;1;;1;T;20;1;42;;;0
1463;99;PFE;PROTHESE DENTAIRE FIXE ESTHETIQUE CCAM;1;9;99;0;;0;;0;Z;;1;0;;;0
1464;99;PDA;PROTHESE DENTAIRE AMOVIBLE CCAM;1;9;99;0;;0;;0;Z;;1;0;;;0
1465;99;IMP;IMPLANTOLOGIE - CCAM;1;9;99;0;;1;;1;T;20;1;25;1;;0
1466;99;TOR;TRAITEMENT ORTHOPEDIE DENTO FACIALE CCAM;1;9;99;0;;0;;0;Z;;1;0;;;0
1470;99;END;ENDODONTIE;1;9;99;0;;1;;1;T;20;1;41;1;;0
1471;99;INO;INLAY-ONLAY, A partir du 01/04/2019 (en date de soins) INLAY-ONLAY TARIF LIBRE;1;9;99;0;;1;;1;T;20;1;41;1;;0
1472;99;TDS;PARODONTOLOGIE;1;9;99;0;;1;;1;T;20;1;25;1;;0
1473;99;ICO;INLAY-CORE, A partir du 01/04/2019 (en date de soins) INLAY-CORE TARIF LIBRE;1;9;99;0;;1;;1;T;20;1;42;;;0
1474;99;PAM;PROTHESE AMOVIBLE DEFINITIVE METALLIQUE, A partir du 01/04/2019 (en date de soins) PROTHESE AMOVIBLE METALLIQUE TARIF LIBRE;1;9;99;0;;1;;1;T;20;1;42;;;0
1475;99;PDT;PROTHESE DENTAIRE PROVISOIRE, A partir du 01/04/2019 (en date de soins) COURONNE TRANSITOIRE TARIF LIBRE;1;9;99;0;;1;;1;T;20;1;42;;;0
1476;99;PFC;PROTHESE FIXE CERAMIQUE, A partir du 01/04/2019 (en date de soins) PROTHESE FIXE CERAMIQUE TARIF LIBRE;1;9;99;0;;1;;1;T;20;1;42;;;0
1477;99;RPN;REPARATION SUR PROTHESE, A partir du 01/04/2019 (en date de soins) REPARATION PROTHESE TARIF LIBRE;1;9;99;0;;1;;1;T;20;1;42;;;0
1511;99;A;FORFAIT D  ACCOUCHEMENT SIMPLE DES SAGES-FEMMES (FORFAIT N91);1;9;99;0;;0;;1;Z;;0;1;;fermé le 21/11/2004;0
1512;99;AM;FORFAIT D  ACCOUCHEMENT MULTIPLE DES SAGES-FEMMES (FORFAIT N92);1;9;99;0;;0;;1;Z;;0;1;;ferme le 21/11/2004;0
1521;99;MG;MAJORATION POUR GARDE;1;9;99;1;7;0;;1;Z;20;0;1;;;0
1522;99;MA;MAJORATION ASTREINTE;1;9;99;1;7;0;;1;Z;20;0;1;;;0
1523;99;PRC;Permanence Rémunération demi-journée Chirurgien-dentiste;1;9;99;0;;0;;1;Z;20;0;47;;;0
1601;99;CPU;CONTRAT PRATIQUE VERSEMENT UNIQUEMENT;1;9;99;0;;0;;1;Z;20;0;47;;;0
1602;99;CBP;FORFAIT CONTRAT DE BONNES PRATIQUES;1;9;99;0;;0;;1;Z;20;0;47;;;0
1603;99;CP1;FORFAIT CONTRAT DE BONNES PRATIQUES CP1;1;9;99;0;;0;;1;Z;20;0;50;;fermé le 31/12/2007;0
1604;99;CP2;FORFAIT CONTRAT DE BONNES PRATIQUES CP2;1;9;99;0;;0;;1;Z;20;0;50;;fermé le 31/12/2008;0
1605;99;CP3;FORFAIT CONTRAT DE BONNES PRATIQUES CP3;1;9;99;0;;0;;1;Z;20;0;50;;;0
1606;99;CPL;FORFAIT CONTRAT DE BONNES PRATIQUES;1;9;99;0;;0;;1;Z;20;0;47;;;0
1607;99;CSI;FORFAIT CONTRAT DE SANTE PUBLIQUE INFIRMIER;1;9;99;0;;0;;1;Z;20;0;46;;fermé le01/01/2010;0
1608;99;CSL;FORFAIT CONTRAT DE SANTE PUBLIQUE BIOLOGISTES;1;9;99;0;;0;;1;Z;20;0;46;;;0
1609;99;CBR;CONTRAT DE BONNES PRATIQUES ZONE RURAL;1;9;99;0;;0;;1;Z;20;0;47;;;0
1610;99;CAD;RÉMUNÉRATION CONTRAT D'ACCÈS AUX SOINS DENTAIRES;1;9;99;0;;0;;0;Z;20;0;0;;;0
1611;99;CBM;CONTRAT DE BONNES PRATIQUES ZONE MONTAGNE;1;9;99;0;;0;;1;Z;20;0;47;;;0
1612;99;CBU;CONTRAT DE BONNES PRATIQUES ZONE URBAINE;1;9;99;0;;0;;1;Z;20;0;47;;;0
1613;99;ZFU;CONTRAT DE BONNES PRATIQUES ZONE FRANCHE URBAINE;1;9;99;0;;0;;1;Z;20;0;47;;;0
1614;99;CP6;CONTRAT DE BONNES PRATIQUES TRANSPORTEURS 2006;1;9;99;0;;0;;1;Z;20;0;50;;;0
1615;99;CP7;CONTRAT DE BONNES PRATIQUES TRANSPORTEURS 2007;1;9;99;0;;0;;1;Z;20;0;50;;;0
1616;99;CP8;CONTRAT DE BONNES PRATIQUES TRANSPORTEURS 2008;1;9;99;0;;0;;1;Z;20;0;50;;;0
1617;99;RCC;REDEVANCE CHEF DE CLINIQUE;1;9;99;0;;0;;1;Z;20;0;47;;;0
1618;99;CRC;COMPLEMENT DE REMUNERATION CHEF DE CLINIQUE;1;9;99;0;;0;;1;Z;20;0;47;;;0
1619;99;CSS;CONTRAT SANTE SOLIDARITE;1;9;99;0;;0;;1;Z;20;0;47;;;0
1621;99;CAT;CONTRAT D'AMELIORATION DE L'ORGANISATION DES SOINS - TRANSPORTS;1;9;99;0;;0;;0;Z;20;0;0;;;0
1622;99;CAP;CONTRAT D'AMELIORATION DE L'ORGANISATION DES SOINS - PHARMACIE/LPP;1;9;99;0;;0;;0;Z;20;0;0;;;0
1623;99;RCT;REVERSEMENTS CONTRAT D'AMELIORATION DE L'ORGANISATION DES SOINS TRANSPORTS;1;9;99;0;;0;;0;Z;20;0;0;;;0
1624;99;RCL;REVERSEMENTS CONTRAT D'AMELIORATION DE L'ORGANISATION DES SOINS - PHARMACIE / LPP;1;9;99;0;;0;;0;Z;20;0;0;;;0
1625;99;PCT;PENALITES CONTRAT D'AMELIORATION DE L'ORGANISATION DES SOINS - TRANSPORT;1;9;99;0;;0;;0;Z;20;0;0;;;0
1626;99;PCL;PENALITES CONTRAT D'AMELIORATION DE L'ORGANISATION DES SOINS - PHARMACIE / LPP;1;9;99;0;;0;;0;Z;20;0;0;;;0
1627;99;CIC;CONTRAT INCITATIF CHIRURGIEN-DENTISTE;1;9;99;0;;0;;1;Z;20;0;47;;;0
1628;99;ODG;DEMO. AIDE FORFAITAIRE GROUPE;1;9;99;0;;0;;1;Z;21;0;47;;;0
1629;99;ODP;DEMO. AIDE FORFAITAIRE POLE SANTE;1;9;99;0;;0;;1;Z;21;0;47;;;0
1630;99;DAG;DEMO. ACTIVITE GROUPE;1;9;99;0;;0;;1;Z;21;0;47;;;0
1631;99;DOP;DEMO. ACTIVITE POLE SANTE;1;9;99;0;;0;;1;Z;21;0;47;;;0
1632;99;STA;SST AIDE ACTIVITE;1;9;99;0;;0;;1;Z;21;0;47;;;0
1633;99;STD;SST FRAIS DEPLACEMENT;1;9;99;0;;0;;1;Z;21;0;47;;;0
1634;99;CDG;CONTESTATION POUR AIDE FORFAITAIRE POUR LES ADHERENTS A L'OPTION DEMOGRAPHIE DANS UN GROUPE;1;9;99;0;;0;;1;Z;21;0;47;;;0
1635;99;CDP;CONTESTATION POUR AIDE FORFAITAIRE POUR LES ADHERENTS A L'OPTION DEMOGRAPHIE DANS UN POLE DE SANTE;1;9;99;0;;0;;1;Z;21;0;47;;;0
1636;99;CAG;CONTESTATION POUR AIDE A L'ACTIVITE POUR LES ADHERENTS A L'OPTION DEMOGRAPHIE DANS UN GROUPE;1;9;99;0;;0;;1;Z;21;0;47;;;0
1637;99;CAS;CONTESTATION POUR AIDE A L'ACTIVITE POUR LES ADHERENTS A L'OPTION DEMOGRAPHIE DANS UN POLE DE SANTE;1;9;99;0;;0;;1;Z;21;0;47;;;0
1638;99;CTA;CONTESTATION POUR AIDE A L'ACTIVITE POUR LES ADHERENTS A L'OPTION SST;1;9;99;0;;0;;1;Z;21;0;47;;;0
1639;99;CTD;CONTESTATION POUR FRAIS DE DEPLACEMENT POUR LES ADHERENTS A L'OPTION SST;1;9;99;0;;0;;1;Z;21;0;47;;;0
1640;99;CIM;FORFAIT AIDE A L'INSTALLATION DU MEDECIN - CAIM;1;9;99;0;;0;;1;Z;21;0;47;;;0
1641;99;MAI;MAJORATION AIDE À L'INSTALLATION DU MEDECIN - CAIM;1;9;99;0;;0;;1;Z;21;0;47;;;0
1642;99;EHP;MAJORATION POUR EXERCICE PARTIEL EN HÔPITAL DE PROXIMITÉ - CAIM;1;9;99;0;;0;;1;Z;21;0;47;;;0
1643;99;PAA;PAIEMENT AIDE ACTIVITE - CSTM;1;9;99;0;;0;;1;Z;21;0;47;;;0
1644;99;MAM;MAJO REMUNERATION ARS - CSTM;1;9;99;0;;0;;1;Z;21;0;47;;;0
1645;99;DEP;PAIEMENT PRISE EN CHARGE FRAIS DEPLACEMENT - CSTM;1;9;99;0;;0;;1;Z;21;0;47;;;0
1646;99;AIF;AIDE FORFAITAIRE - COSCOM;1;9;99;0;;0;;1;Z;21;0;47;;;0
1647;99;RMS;REMUNERATION COMPLEMENTAIRE ACCUEIL DE STAGIAIRE - COSCOM;1;9;99;0;;0;;1;Z;21;0;47;;;0
1648;99;RHP;REMUNERATION COMPLEMENTAIRE EXERCICE EN HOPITAL - COSCOM;1;9;99;0;;0;;1;Z;21;0;47;;;0
1649;99;MAO;PAIEMENT MAJORATION DE LA REMUNERATION ARS - COSCOM;1;9;99;0;;0;;1;Z;21;0;47;;;0
1650;99;CAA;AIDE A L'ACTIVITE   COTRAM;1;9;99;0;;0;;1;Z;21;0;47;;;0
1651;99;MRA;PAIEMENT MAJORATION REMUNERATION ARS   COTRAM;1;9;99;0;;0;;1;Z;21;0;47;;;0
1652;99;RFC;PTMR  -  REMPLACEMENT;1;9;99;0;;0;;1;Z;20;0;47;;;0
1653;99;RCR;PTMR  - MALADIE, MATERNITE, PATERNITE;1;9;99;0;;0;;1;Z;20;0;47;;;0
1701;99;CMD;CDS  MEDICAL OPTANT FORF DEBUT;1;9;99;0;;0;;0;Z;20;0;0;;;0
1702;99;CMF;CDS MEDICAL OPTANT FORF FIN;1;9;99;0;;0;;0;Z;20;0;0;;;0
1703;99;CMT;CDS MEDICAL OPTANT FORFTACITE;1;9;99;0;;0;;0;Z;20;0;0;;;0
1704;99;CDI;CDS DENTAIRE OPTANT FORF INITIAL;1;9;99;0;;0;;0;Z;20;0;0;;;0
1705;99;CDS;CDS DENTAIRE OPTANT FORF SUIVI;1;9;99;0;;0;;0;Z;20;0;0;;;0
1706;99;CDF;CDS DENTAIRE OPTANT FORF FINAL;1;9;99;0;;0;;0;Z;20;0;0;;;0
1707;99;CID;CDS INFIRMIER OPTANT FORF DEBUT;1;9;99;0;;0;;0;Z;20;0;0;;;0
1708;99;CIF;CDS INFIRMIER OPTANT FORF FIN;1;9;99;0;;0;;0;Z;20;0;0;;;0
1711;99;MRD;FORFAIT MEDECIN REFERENT DEBUT DE CONTRAT;1;9;99;0;;0;;1;Z;20;0;46;;fermé le 28/02/2007;0
1712;99;MRF;FORFAIT MEDECIN REFERENT FIN DE CONTRAT;1;9;99;0;;0;;1;Z;20;0;46;;fermé le 28/02/2007;0
1715;99;FMC;FORFAIT MENSUEL COORDONNATEUR;1;9;99;0;;0;;1;Z;20;0;47;;;0
1716;99;FMP;FORFAIT MENSUEL PARTICIPATION;1;9;99;0;;0;;1;Z;20;0;47;;;0
1717;99;FMS;FORFAIT MENS  UEL SOINS;1;9;99;0;;0;;1;C;20;0;46;;;0
1718;99;FAZ;FORFAIT D'ADHESION ZONE DEFICITAIRE;1;9;99;0;;0;;1;Z;20;0;47;;;0
1721;99;F01;FORFAIT PROFESSIONNEL (F01) FILIERES ET RESEAUX;1;9;99;0;;0;;1;C;20;0;46;;;0
1722;99;F02;FORFAIT PROFESSIONNEL (F02) FILIERES ET RESEAUX;1;9;99;0;;0;;1;C;20;0;46;;;0
1723;99;F03;FORFAIT PROFESSIONNEL (F03) FILIERES ET RESEAUX;1;9;99;0;;0;;1;C;20;0;46;;;0
1724;99;F04;FORFAIT PROFESSIONNEL (F04) FILIERES ET RESEAUX;1;9;99;0;;0;;1;C;20;0;46;;;0
1725;99;F05;FORFAIT PROFESSIONNEL (F05) FILIERES ET RESEAUX;1;9;99;0;;0;;1;C;20;0;46;;;0
1726;99;F06;FORFAIT PROFESSIONNEL (F06) FILIERES ET RESEAUX;1;9;99;0;;0;;1;C;20;0;46;;;0
1727;99;F07;FORFAIT PROFESSIONNEL (F07) FILIERES ET RESEAUX;1;9;99;0;;0;;1;C;20;0;46;;;0
1728;99;F08;FORFAIT PROFESSIONNEL (F08) FILIERES ET RESEAUX;1;9;99;0;;0;;1;C;20;0;46;;;0
1729;99;F09;FORFAIT PROFESSIONNEL (F09) FILIERES ET RESEAUX;1;9;99;0;;0;;1;C;20;0;46;;;0
1731;99;F10;FORFAIT PROFESSIONNEL (F10) FILIERES ET RESEAUX;1;9;99;0;;0;;1;C;20;0;46;;;0
1732;99;F11;FORFAIT PROFESSIONNEL (F11) FILIERES ET RESEAUX;1;9;99;0;;0;;1;C;20;0;46;;;0
1733;99;F12;FORFAIT PROFESSIONNEL (F12) FILIERES ET RESEAUX;1;9;99;0;;0;;1;C;20;0;46;;;0
1734;99;F13;FORFAIT PROFESSIONNEL (F13) FILIERES ET RESEAUX;1;9;99;0;;0;;1;C;20;0;46;;;0
1735;99;F14;FORFAIT PROFESSIONNEL (F14) FILIERES ET RESEAUX;1;9;99;0;;0;;1;C;20;0;46;;;0
1736;99;F15;FORFAIT PROFESSIONNEL (F15) FILIERES ET RESEAUX;1;9;99;0;;0;;1;C;20;0;46;;;0
1741;99;FC0;FORFAIT CONSULTATION (FC0) FILIERES ET RESEAUX;1;9;99;0;;0;;1;Z;20;0;47;;;0
1742;99;FC1;FORFAIT CONSULTATION (FC1) FILIERES ET RESEAUX;1;9;99;0;;0;;1;Z;20;0;47;;;0
1743;99;FC2;FORFAIT CONSULTATION (FC2) FILIERES ET RESEAUX;1;9;99;0;;0;;1;Z;20;0;47;;;0
1744;99;FC3;FORFAIT CONSULTATION (FC3) FILIERES ET RESEAUX;1;9;99;0;;0;;1;Z;20;0;47;;;0
1745;99;FC4;FORFAIT CONSULTATION (FC4) FILIERES ET RESEAUX;1;9;99;0;;0;;1;Z;20;0;47;;;0
1746;99;FC5;FORFAIT CONSULTATION (FC5) FILIERES ET RESEAUX;1;9;99;0;;0;;1;Z;20;0;47;;;0
1747;99;FC6;FORFAIT CONSULTATION (FC6) FILIERES ET RESEAUX;1;9;99;0;;0;;1;Z;20;0;47;;;0
1748;99;FC7;FORFAIT CONSULTATION (FC7) FILIERES ET RESEAUX;1;9;99;0;;0;;1;Z;20;0;47;;;0
1749;99;FC8;FORFAIT CONSULTATION (FC8) FILIERES ET RESEAUX;1;9;99;0;;0;;1;Z;20;0;47;;;0
1751;99;FC9;FORFAIT CONSULTATION (FC9) FILIERES ET RESEAUX;1;9;99;0;;0;;1;Z;20;0;47;;;0
1761;99;FF0;FORFAIT FORMATION (FF0) FILIERES ET RESEAUX;1;9;99;0;;0;;1;Z;20;0;47;;;0
1762;99;FF1;FORFAIT FORMATION (FF1) FILIERES ET RESEAUX;1;9;99;0;;0;;1;Z;20;0;47;;;0
1763;99;FF2;FORFAIT FORMATION (FF2) FILIERES ET RESEAUX;1;9;99;0;;0;;1;Z;20;0;47;;;0
1764;99;FF3;FORFAIT FORMATION (FF3) FILIERES ET RESEAUX;1;9;99;0;;0;;1;Z;20;0;47;;;0
1765;99;FF4;FORFAIT FORMATION (FF4) FILIERES ET RESEAUX;1;9;99;0;;0;;1;Z;20;0;47;;;0
